tweet,clean,date,time,link
covid can spread through internet daw,covid spread internet daw,2020-03-11,09:05:53+00:00,https://twitter.com/TheBrandyP22/status/1237666039162421248
penge ncov,penge ncov,2020-03-11,09:00:25+00:00,https://twitter.com/Poyyoypi/status/1237664665506738177
"COVID REMEDY @Eastwind Homes Subd. Montalban, Rizal https://www.instagram.com/p/B9ll8pxAZ-8/?igshid=toymlanj3mmb",covid remedy homes subd montalban rizal,2020-03-11,08:54:49+00:00,https://twitter.com/emeyes_/status/1237663255260213248
"we’ll be loyal, we’ll be loyal to thee we shall sing and for thy honor we shall live! COVID-19 WHO???? ",well loyal well loyal thee shall sing thy honor shall live covid,2020-03-11,08:43:30+00:00,https://twitter.com/nikkamanalac/status/1237660406891479040
"Grabe yung Covid-19 hanggang ML meron, ",grabe covid ml meron,2020-03-11,08:16:14+00:00,https://twitter.com/jilariricafort/status/1237653544519393280
Marikina Rep. Bayani Fernando recommends the quarantine of animals to control the spread of COVID-19.,marikina rep bayani fernando recommends quarantine animals control spread covid,2020-03-11,07:48:08+00:00,https://twitter.com/kim_badbadon/status/1237646473229037568
HAHAHHA ARAT COVID LANG YAN GALA TAYO,hahahha arat covid yan gala,2020-03-11,06:36:31+00:00,https://twitter.com/NutEllaaaa_18/status/1237628453144281090
"Ngayong dumadami na ang Corona Virus (COVID-19) cases sa Pilipinas, kailangan nating palaging maging healthy at malakas ang pangangatawan. Apart sa paghuhugas ng kamay/paggamit ng isopropyl alcohol (70% solution)… https://www.instagram.com/p/B9lNxjRJnaz/?igshid=pk2atq6z18kn",ngayong dumadami corona virus covid cases pilipinas nating palaging healthy malakas pangangatawan apart paghuhugas kamay paggamit isopropyl alcohol solution,2020-03-11,05:23:37+00:00,https://twitter.com/_riajazmine_/status/1237610104637120513
"Kahit buhus-buhusan ng mga tao katawan nila ng alcohol at Lysol 24/7, wala naman katuturan ang panic buying dahil kawawa ang mga at-risk talaga (specifically, the health workers), lalong kakalat ang coronavirus",buhus buhusan tao katawan alcohol lysol katuturan panic buying kawawa risk specifically health workers lalong kakalat coronavirus,2020-03-11,04:34:31+00:00,https://twitter.com/itsenzobishes/status/1237597747911356417
NCOV LANG YAN MAGLALARO PARIN AKO! ,ncov yan maglalaro parin,2020-03-11,04:31:28+00:00,https://twitter.com/keymaneluh/status/1237596979842011136
"ampalaya + monggo tngina sarap, mapapalaban talaga sa ncov",ampalaya monggo tngina sarap mapapalaban ncov,2020-03-11,04:05:23+00:00,https://twitter.com/Bryanpaguian0/status/1237590415844368384
Trueelyy sis. Parang may mga ncov na ata sa sobrang lilikot,trueelyy sis parang ncov ata sobrang lilikot,2020-03-11,03:56:07+00:00,https://twitter.com/jbaylon28/status/1237588083739996170
"I stopped touching my face eversince I learned how to use makeup and that was 20 years ago. So, no, I don’t think I will get infected with COVID-19.",stopped touching eversince learned use makeup years ago dont think get infected covid,2020-03-11,03:54:16+00:00,https://twitter.com/catroach/status/1237587620374253569
I wonder if the UK health minister will count as a super spreader of covid-19. You couldn’t write this shit.,wonder uk health minister count super spreader covid couldnt write shit,2020-03-11,00:52:51+00:00,https://twitter.com/cYnborg/status/1237541966016966657
Ayon sa ilang eksperto ang covid19 ay pinagsamang bagsik ng coronavirus at aids. ,ayon ilang eksperto covid19 pinagsamang bagsik coronavirus aids,2020-03-10,23:14:15+00:00,https://twitter.com/junepineda8/status/1237517153269469184
kanina kakaen kme sa mang inasal ni bryan tapos magkakamay sha ako mag spoon & fork tas hinugasan ko yung dalawa tapos sbe nya mamaya may ncov gumamit nyan sbe ko lagyan ko ng alcohol whahahahahahhahhhaaha,kanina kakaen kme mang inasal bryan tapos magkakamay sha spoon fork hinugasan tapos sbe nya mamaya ncov gumamit nyan sbe lagyan alcohol whahahahahahhahhhaaha,2020-03-10,16:57:07+00:00,https://twitter.com/camsfeyey/status/1237422241563860993
Magiging okay ang lahat yang NCov na yannn mawawala dinn yan...,magiging okay yang ncov yannn mawawala dinn yan,2020-03-10,16:04:54+00:00,https://twitter.com/kimsicogsi/status/1237409102306762753
HAHAHAHAHA COVID KA LANG WALWALERA SILA ,covid walwalera,2020-03-10,15:12:54+00:00,https://twitter.com/_notsolovely/status/1237396017500147713
COVID - 19 Christ Over Virus Infected Disease ,covid christ virus infected disease,2020-03-10,15:09:06+00:00,https://twitter.com/pauldinganda/status/1237395059605045248
singkit lang pero walang ncov ,singkit ncov,2020-03-10,13:44:05+00:00,https://twitter.com/pokugumaru/status/1237373665496330241
"Everytime paguusapan sa bahay ang COVID, laging may ""Kaya ikaw Lyka, magvitamins ka, wag magpuyat, kumain ng gulay at prutas atbp"" hahahahahaha",everytime paguusapan bahay covid laging lyka magvitamins magpuyat kumain gulay prutas atbp,2020-03-10,13:35:24+00:00,https://twitter.com/MissTulalian/status/1237371476958777355
Ge palakasan na lang resistensya ncov hayup ka,palakasan resistensya ncov hayup,2020-03-10,12:28:34+00:00,https://twitter.com/kellietwashun/status/1237354659682996224
HINDI BA NAMAMATAY ANG NCOV SA INET NG BANSA,namamatay ncov inet bansa,2020-03-10,11:53:59+00:00,https://twitter.com/Jmramoss_/status/1237345957668257792
pano kaya kung yung COVID-19 vaccine ang magfail tapos magstart yung zombie apocalypse omgggggg dejoke lang,covid vaccine magfail tapos magstart zombie apocalypse omgggggg dejoke,2020-03-10,11:42:32+00:00,https://twitter.com/Nichiirawberry/status/1237343076059721728
Sabi ng wifey ko wala na daw alcohol sa bahay for sanitization purposes amidst the present situation - COVID-19. Pero meron akong stock Martell Cordon Bleu. ,wifey daw alcohol bahay sanitization purposes amidst present situation covid meron akong stock martell cordon bleu,2020-03-10,11:11:50+00:00,https://twitter.com/jn_limuaco/status/1237335351171022848
And there are rumors that this covid-19 is not actually came from an animal but it was made by chinese for biological warfare. I dont know how true is this but it is a serious issue now that it affects the whole world.,rumors covid actually came animal made chinese biological warfare dont know true serious issue affects whole world,2020-03-10,10:23:18+00:00,https://twitter.com/kit_ballesteros/status/1237323136707657728
"These two DDS looney informed the public through their program ""punto por punto"" - that the Filipinos don’t have to panic. They compared d COVID-19 with tuberculosis as the latter is highly contagious w/a high mortality death rate. The 2 DDS belong to the blind loyalty society. ",two dds looney informed public program punto punto filipinos dont panic compared covid tuberculosis latter highly contagious high mortality death rate dds belong blind loyalty society,2020-03-10,09:58:08+00:00,https://twitter.com/jn_limuaco/status/1237316800645222400
ANTIBODIES ACTIVATE Two of the 10 ways our resident nutritionist and columnist at @mblifestyle @cheshireque recommends to boost the immune system in this time of the COVID-19 crisis are to 1.) eat at least two… https://www.instagram.com/p/B9jHIKCn7ej/?igshid=10ycj3ajaegpv,antibodies activate two ways resident nutritionist columnist recommends boost immune system time covid crisis eat least two,2020-03-10,09:47:23+00:00,https://twitter.com/aapatawaran/status/1237314096220884992
Been taking vitamins simula nung nag karon nung first case ng covid. I always carry my little alcohol and may mask din ako kasi may ubo din ako.,taking vitamins simula nag karon first case covid always carry little alcohol mask kasi ubo,2020-03-10,09:32:16+00:00,https://twitter.com/ianxvllsnt/status/1237310291760664578
Sorry kayo yung head namin nag-aaya mag-vodka to fight COVID-19. SANA ALL BA? HAHAHAHAHAHAHAHA,sorry head nag aaya vodka fight covid,2020-03-10,09:28:35+00:00,https://twitter.com/TheRJReyes_/status/1237309364383272963
"Kapag naka-motor ka tapos may checkpoint, ubohan mo ’yung lisensya mo tapos sabihin mo may nCoV ka. Exempted ka na ",naka motor tapos checkpoint ubohan mo lisensya mo tapos mo ncov exempted,2020-03-10,08:37:15+00:00,https://twitter.com/paullaxamana_/status/1237296447092953089
Magkakaroon ng gamot sa COVID pero sa bobong katulad mo wala na. ,magkakaroon gamot covid bobong mo,2020-03-10,08:19:49+00:00,https://twitter.com/joestephh/status/1237292059662270465
"Feeling ko hindi naman ako kakapitan ng NCov na yan, kasi wala naman nagstay saken, lahat bumitaw.... ",feeling kakapitan ncov yan kasi nagstay saken bumitaw,2020-03-10,08:01:13+00:00,https://twitter.com/B_o_j_o_y/status/1237287378051420162
GAGO SABI KO KAY MAMA MAG-ALCOHOL SIYA LAGI KASI 35 CASES NA ANG COVID-19 SA PH TAS SINAGOT BA NAMAN SA’KIN GIN POMELO LANG ANG SAGOT DO’N HAHAHAHAHAHAHAHAHAHAHAHAHAHAHAHAHAHAHAHAHAHAHAHAHAHAHAHAHAHAHAHAHA,kay mama alcohol kasi cases covid ph sinagot sakin gin pomelo sagot hahahahahahahahahahahahahahahahahahahahahahahahahahahahahahahahaha,2020-03-10,07:21:36+00:00,https://twitter.com/_caspecoleen/status/1237277408819990529
"Kung ako lang ha, wag na tayo masyado mag cause ng panic. Alam naman natin na meron Covid All we need is to take proper precautions. Wash hands often and drink Vitamin C.",cause panic alam natin meron covid need proper precautions wash hands often drink vitamin,2020-03-10,07:16:42+00:00,https://twitter.com/k01k1ngd0m/status/1237276175275151360
"During month of January and February. Pinoys be like: ""Naku may cases na tau ng COVID-19 kino-cover up lag yan ng DOH"" Month of March and counting: DOH Update ""35 confirmed COVID-19 in the Philippines"". Pinoys be like, *speechless*, *shocked*, *scared*, *panic*",month january february pinoys like naku cases tau covid kino cover lag yan doh month march counting doh update confirmed covid philippines pinoys like speechless shocked scared panic,2020-03-10,07:16:04+00:00,https://twitter.com/allanalde_/status/1237276017917440000
"Not all NCOV are scary and deadly some are cute and huggable. Meet Mirriam’s newest pup his name is Encove #puppie #puppielove #puppyoftheday @Brgy. Santolan, Pasig City https://www.instagram.com/p/B9i1fXlnbwiZHKVUsvRgaFzlK_1airPO-eUPkw0/?igshid=1osdl8f44u1wy",ncov scary deadly cute huggable meet mirriams newest pup encove santolan pasig city,2020-03-10,07:12:55+00:00,https://twitter.com/msuniversemimi/status/1237275223084466176
Remember these rules - #Precaution and #Prevention are the best weapons to fight against the Coronavirus. - Prepare your PPE - N95 / Surgical Mask - Wash your hands with soap and water - Keep your immune system up to date - with the right supplements,remember rules best weapons fight coronavirus prepare ppe n95 surgical mask wash hands soap water keep immune system date right supplements,2020-03-10,07:02:56+00:00,https://twitter.com/sidluna_/status/1237272711329509376
"Precaution and Preventive Health VS. Covid-19 With the #coronavirus outbreak across the world, whilst we are busy equipping ourselves with physical barrier PPE - masks and hand sanitizer etc, don’t forget to boost your last line of defence - your #ImmuneSystem.",precaution preventive health vs covid outbreak across world whilst busy equipping physical barrier ppe masks hand sanitizer etc dont forget boost last line defence,2020-03-10,07:02:55+00:00,https://twitter.com/sidluna_/status/1237272707512717312
SHET NASA IMUS NA! KONTING KEMBOT BACOOR NA. SO I GUESS COVID-19 TALAGA ANG PAPATAY SA AKIN. OH WELL. ,shet nasa imus konting kembot bacoor guess covid papatay well,2020-03-10,06:55:39+00:00,https://twitter.com/mahnaipo/status/1237270880205434881
And your point is??? At least manageable siya. E ang coronavirus?,point least manageable coronavirus,2020-03-10,06:51:35+00:00,https://twitter.com/hoeofknl/status/1237269856069640192
"Grabe na yung Ncov kakaloka, ugaliin ang proper hand washing tas mag VitC lagi. Wag din daw mag panic kasi balita ko immune daq sa virus yung mga pretty CHAROT",grabe ncov kakaloka ugaliin proper hand washing vitc daw panic kasi balita immune daq virus pretty charot,2020-03-10,06:42:43+00:00,https://twitter.com/pinoytwinken/status/1237267625073242114
Napaka-init today! I hope this weather helps reduce the spread of covid-19. ,init today hope weather helps reduce spread covid,2020-03-10,06:41:14+00:00,https://twitter.com/jekventures/status/1237267249120993281
may covid 19 din ata tong computer namin e grr,covid ata computer grr,2020-03-10,06:17:45+00:00,https://twitter.com/dlwlrma00000/status/1237261340562997248
Isang magandang hapon at nakakabahala ng dahil sa COVID 19 Lage po tayong mag iingat KaPamilya :)Panatilihin ang maging malinis. KIANO PerfectMarch @_kiatakahashi @iamginoroqueiv,magandang hapon nakakabahala covid lage tayong iingat kapamilya panatilihin malinis kiano perfectmarch,2020-03-10,06:08:24+00:00,https://twitter.com/ArleneMadrid2/status/1237258989705953280
NCOV ka lang gala akong tao!!! ,ncov gala akong tao,2020-03-10,06:02:22+00:00,https://twitter.com/itsmetellyyy/status/1237257471044935687
it’s so scary ncov is everywhere. take care always guys and maligo kayong lahat!!,scary ncov everywhere always guys maligo kayong,2020-03-10,05:49:36+00:00,https://twitter.com/pelayochlo/status/1237254257201557504
"Kung kailan kumalat ang local cases ng COVID-19 sa Pinas saka naitala ang pinakamainit na temperatura sa bansa ngayong 2020. Totoo man o hindi na namamatay sa mataas na temperatura ang virus, malinaw na pag-iingat ng Dios ’to sa atin. Instead of ranting, be grateful. Roma 8:28",kailan kumalat local cases covid pinas saka naitala pinakamainit temperatura bansa ngayong totoo namamatay mataas temperatura virus malinaw iingat dios instead ranting grateful roma,2020-03-10,05:22:53+00:00,https://twitter.com/amileskidrauhl/status/1237247531668529152
Concentrated sa Pasig area yung mga nagpa-positive sa COVID-19. Ingat ingat! ,concentrated pasig area nagpa positive covid,2020-03-10,05:11:42+00:00,https://twitter.com/domdomlaurente/status/1237244719362494468
"Japan has more than 500 confirmed cases of COVID-19 yet they are just chill AF. Why? Because they have 1 of the best healthcare in the world and they have proper hygiene. Don’t scare yourselves, ppl. The least you can do is to stay clean as much as possible.",japan confirmed cases covid yet chill best healthcare world proper hygiene dont scare ppl least stay clean much possible,2020-03-10,05:11:16+00:00,https://twitter.com/_vinbermudez/status/1237244611610832897
Kasi sa school niyo di natatablan ng ncov,kasi school niyo natatablan ncov,2020-03-10,04:22:49+00:00,https://twitter.com/glnntrrshndsme/status/1237232418530054144
one random flat-earther said “ang cause ng covid-19 ay ang 5G network wave radiation” which another flat-earther seconded by saying “i agree. and bill gates had something to do with that disease” PANGINOON BAKIT :((,random flat earther said cause covid 5g network wave radiation another flat earther seconded saying agree bill gates something disease panginoon,2020-03-10,04:07:43+00:00,https://twitter.com/patchiepie/status/1237228614774435840
How to fight ncov Wash your habds frequent Eat right Exercise more Sleep enough Sanitize regularly Take multivitamins,fight ncov wash habds frequent eat right exercise sleep enough sanitize regularly multivitamins,2020-03-10,02:58:16+00:00,https://twitter.com/POGS0528/status/1237211137306853378
Watched Duterte’s press conference regarding COVID-19. Natawa na lang ako. “Tang inang virus na yan. Saan ba naktira yan.” Akala ko iihian na naman niya eh. ,watched dutertes press conference regarding covid natawa tang inang virus yan naktira yan akala iihian,2020-03-10,01:10:01+00:00,https://twitter.com/_vinbermudez/status/1237183895184920577
"I think it’s a good thing that PH is super hot again, I mean, they told us COVID-19 has low chances of surviving in this kind of weather temperature, right?",think good thing ph super hot mean told us covid low chances surviving kind weather temperature right,2020-03-10,00:40:32+00:00,https://twitter.com/Nichiirawberry/status/1237176478602637312
"Be scared if you’re, immunocompromised.If not, then get infected, cure the opportunistic infections & complication,bounce back , and survive. As easy as that. #CovID19ph #CoronaVirus #NcovPh",scared youre immunocompromised get infected cure opportunistic infections complication bounce back survive easy,2020-03-09,23:38:45+00:00,https://twitter.com/ILoveTansyong/status/1237160928413548544
"Parang ansarap maginom, iwas ncov hahaha",parang ansarap maginom iwas ncov,2020-03-09,23:11:17+00:00,https://twitter.com/wakisd/status/1237154016972255233
JAX kontra COVID! ,jax kontra covid,2020-03-09,23:06:18+00:00,https://twitter.com/ExOfficerSantos/status/1237152764087566336
"COVID 19 Teusday Advice. Now that the cases have gone up to 10 and rising in Philippines, please take this free medical advice. Wash hands always, and use alcohol sprays when possible. stop shaking people and most importantly STOP KISSING,",covid teusday advice cases gone rising philippines please free medical advice wash hands always use alcohol sprays possible stop shaking people importantly stop kissing,2020-03-09,22:26:23+00:00,https://twitter.com/terryjay55/status/1237142717911592960
"Maganda rin ang ipinunto ng isang kasama na hindi malabo ito. Pinilit na itago ang cases ng covid 19 para maiwasan ang public panic, at ngayon na final reading na ng mga polisiyang anti-mamamayan ay pinaingay para isway ang atensyon ng mamamayan. Gaya ng security of tenure ++",maganda rin ipinunto kasama malabo pinilit itago cases covid maiwasan public panic final reading polisiyang anti mamamayan pinaingay isway atensyon mamamayan gaya security tenure,2020-03-09,15:33:32+00:00,https://twitter.com/sailorporn/status/1237038819041366017
"Hindi sa pagiging tamad, pero sana dito din sa Bulacan. Siguro naman lahat tayo natatakot sa NCOV kaya sana naman mag suspend na NATIONWIDE. Mas mahalaga naman siguro yung kalusugan ng nakararami sa ngayon. Madaming may mahihinang Immune System lalo na mga bata. #COVID2019",pagiging tamad bulacan siguro natatakot ncov suspend nationwide mahalaga siguro kalusugan nakararami madaming mahihinang immune system lalo bata,2020-03-09,14:39:41+00:00,https://twitter.com/cipanganiban/status/1237025267752689664
"covid proof mga taga QC, mayor JOY ano na po? ",covid proof taga qc mayor joy,2020-03-09,13:36:36+00:00,https://twitter.com/itstiuuuuu/status/1237009391422812160
"Hello!!! So our prof said that take vitamins with ZINC, it can help you prevent coronavirus ",hello prof said vitamins zinc help prevent coronavirus,2020-03-09,13:20:51+00:00,https://twitter.com/josephdevera_/status/1237005431186157568
"Very alarming na talaga yung COVID. Imagine, even your dog/cat could be a possible carrier.",alarming covid imagine even could possible carrier,2020-03-09,11:12:20+00:00,https://twitter.com/ShannenLaica/status/1236973085560991744
"Vitamin C does no harm to people and is the one of the few, if not the only, agent that has a chance to prevent us from getting, and can treat, COVID-19 infection. (Richard Z. Cheng, MD, PhD, International Vitamin C China Epidemic Medical Support Team Leader)",vitamin harm people agent chance prevent us getting treat covid infection richard cheng md phd international vitamin china epidemic medical support team leader,2020-03-09,09:31:20+00:00,https://twitter.com/caressedy/status/1236947670976958466
"Panic can’t cure Covid-19. Boost your immune system. Proper Hygiene, Hydrate... ",panic cant cure covid boost immune system proper hygiene hydrate,2020-03-09,09:22:07+00:00,https://twitter.com/raymondverdis/status/1236945352126656512
’di naman nila ilalabas tunay na number ng confirmed covid-19 cases kung ’di lumabas balita tungkol sa non-resident aliens na naka acquire ng sakit nung pumunta sa pilipinas Hays.,ilalabas tunay number confirmed covid cases lumabas balita resident aliens naka acquire sakit pilipinas hays,2020-03-09,09:01:49+00:00,https://twitter.com/kimpaoooo/status/1236940241870569472
"If alcohol destroys the lipid layer of the COVID 19 virus, why can’t we all just go out and drink alcohol? I mean, why doesn’t that kill the virus inside? Wouldn’t it be fun if the solution to all this drama is a worldwide drinking fest?",alcohol destroys lipid layer covid virus cant go drink alcohol mean doesnt kill virus inside wouldnt fun solution drama worldwide drinking fest,2020-03-09,08:29:58+00:00,https://twitter.com/nadineberdin/status/1236932224676593664
how to prevent covid? keep it squeaky clean ,prevent covid keep squeaky clean,2020-03-09,06:54:47+00:00,https://twitter.com/MckMoiMoi/status/1236908272138907648
"Sa dami ng Chinese/Taiwanese dito sa Makati di nko nagtaka na my positive sa nCOV. Anyways chill lng kmi dito sa Makati Med. Walang panic , walang gulo. Business as usual. ",dami chinese taiwanese makati nko nagtaka positive ncov anyways chill lng kmi makati panic gulo business usual,2020-03-09,05:30:56+00:00,https://twitter.com/tegoyuuka_kiss/status/1236887172793294848
"may ncov na sa quezon city, stay safe guys!! wear mask and drink water and vitamins huhu ",ncov quezon city stay safe guys wear mask drink water vitamins,2020-03-09,03:45:22+00:00,https://twitter.com/clmaexxi_/status/1236860605782306816
Isa pang nakakatakot sa covid eh yung ma quarantine ka ng ilang araw. Tigil trabaho. Shet. Bawat araw sakin mahalaga. *drinks water*,nakakatakot covid quarantine ilang araw tigil trabaho shet araw sakin mahalaga drinks water,2020-03-09,02:02:04+00:00,https://twitter.com/dadanthology/status/1236834606051016704
"Kung kelan nagconfirm yung ibang bansa na may COVID patient sa kanila galing dito, saka kayo nagconfirm. Halatang-halata eh",kelan nagconfirm ibang bansa covid patient galing saka nagconfirm halatang halata,2020-03-09,01:35:38+00:00,https://twitter.com/kayehkayeh/status/1236827954425942016
May covid na sa qc sana umulan ng alcohol hehehhe,covid qc umulan alcohol hehehhe,2020-03-09,01:00:30+00:00,https://twitter.com/atkinpapi14/status/1236819115349667841
Viral and Bacterial infection are on the rise such as NCOV. For only Php 1750 per year you will get covered for 100K through Insular Health Care. Make sure you and your loved are protected. DM me to know more about… https://www.instagram.com/p/B9eGEV_ALvn/?igshid=gd4xvarb0cn1,viral bacterial infection rise ncov php year get covered 100k insular health make sure loved protected dm know,2020-03-08,15:08:00+00:00,https://twitter.com/proactivePH/status/1236670005535703040
"URGING FUCKING CITY MAYORS & OFFICIALS TO SUSPEND ALL THE CLASSES FOR TOMORROW DUE TO THE NCOV OUTBREAK!!!!! HEALTH MUNA, HIRAP MAGKASAKIT— ITATAGO NIYO MGA GAMOT AT POSSIBLE CURE FOR THIS VIRUS, TAPOS IHO-HOARD NIYO MGA HEALTH PROTECTION PRODUCTS ""CAPITALISM"" #WalangPasok",urging fucking city mayors officials suspend classes tomorrow due ncov outbreak health muna hirap magkasakit itatago niyo gamot possible cure virus tapos iho hoard niyo health protection products capitalism,2020-03-08,13:58:09+00:00,https://twitter.com/rxniersabido/status/1236652429782872066
Nakakatakot naman yung NcOV pero mas natatakot ako kapag nagsara store namin sayang ang sahoood ,nakakatakot ncov natatakot nagsara store sayang sahoood,2020-03-08,12:58:59+00:00,https://twitter.com/maybituinreynan/status/1236637539231916038
My cells working everyday to fight off the virus. #coronavirus #SailorMoon,cells working everyday fight virus,2020-03-08,07:46:30+00:00,https://twitter.com/theearlofjerico/status/1236558899353776128
"Elders are vulnerable to COVID-19. Ingat. Baka kakabuka mo ng bunganga mo, mahawaan ka. Marami magdiriwang. ",elders vulnerable covid baka kakabuka mo bunganga mo mahawaan magdiriwang,2020-03-08,05:53:35+00:00,https://twitter.com/fredprecillas/status/1236530483963420672
No kiss No Holding Hands dahil sa. NCOV Me: Di ko napigilan ,kiss holding hands ncov napigilan,2020-03-08,05:21:22+00:00,https://twitter.com/macgeraldG/status/1236522376143065088
I drank alcohol to prevent me from contacting COVID-19 ,drank alcohol prevent contacting covid,2020-03-08,05:12:28+00:00,https://twitter.com/TheJeromeVargas/status/1236520136078573569
"Pano pag sa aso pala nanggaling yung covid tas nag antigenic shift lang, pwede ba siyang tawaging SCOVIDO? Ok bye.",aso pala nanggaling covid nag antigenic shift pwede siyang tawaging scovido ok bye,2020-03-08,03:47:44+00:00,https://twitter.com/RafIsAFunGuy/status/1236498814053134336
A more effective way than wearing a face mask everyday to prevent ourselves from coronavirus #SpreadAwareness – at Sunz En Coron Resort,effective way wearing mask everyday prevent coronavirus sunz coron resort,2020-03-07,19:25:00+00:00,https://twitter.com/LenBron_27/status/1236372295762903040
"I have watched this TikTok video and the nurse says we can’t protect ourselves from the nCoV by wearing masks. Kung sino lang ang may sakit, ayun lang magmask para ’di makahawa. And we, unaffected piece of shit should practice correct ways of washing our hands.",watched tiktok video nurse says cant protect ncov wearing masks sakit ayun magmask makahawa unaffected piece shit practice correct ways washing hands,2020-03-07,16:43:26+00:00,https://twitter.com/eileencndlr/status/1236331634690940928
TANGINA MO COVID 19! DI NAMAN NAMIN NEED NG MEET AND GREET MO DITO SA EAST. Dfq. ,mo covid need meet greet mo east dfq,2020-03-07,12:41:31+00:00,https://twitter.com/DirekJPlnc/status/1236270757086298112
"I noticed politicians and biz executives have refused to shake hands, I’m curious though how does that square with banging their prostitutes #coronavirus",noticed politicians executives refused shake hands curious though square banging prostitutes,2020-03-07,10:17:40+00:00,https://twitter.com/raymerrill/status/1236234554060337152
