tweet,clean,date,time,link
"Happy, happy birthday robiesianquita I wish for your great health (especially kontra COVID) and less stress para no more stress-rashes and you get to reserve your high pitch tone just for videoke! Luv yah ghorl! … https://www.instagram.com/p/B9tYEMfH55Z/?igshid=hngyz086z2ks",happy happy birthday robiesianquita wish great health especially kontra covid less stress stress rashes get reserve high pitch tone videoke luv yah ghorl,2020-03-14,09:27:27+00:00,https://twitter.com/ohkayeg/status/1238758630935023616
Parang mas kailangan pa atang i-suggest na wag maniwala at magshare sa fakenews abt NCOV kesa sa pagsusuot ng face mask...,parang atang suggest maniwala magshare fakenews abt ncov kesa pagsusuot mask,2020-03-11,13:52:19+00:00,https://twitter.com/justine_cstll/status/1237738122013585409
Nakakalungkot lang kasi pati pagsamba kailangan muna itigil para lang makaiwas sa Covid-19 ,nakakalungkot kasi pati pagsamba muna itigil makaiwas covid,2020-03-16,18:31:32+00:00,https://twitter.com/ellamaxenee/status/1239620332673060866
"Sinuspended para makaiwas sa COVID-19, ndi para gumala HAHAHakdog",sinuspended makaiwas covid ndi gumala hahahakdog,2020-03-10,04:57:45+00:00,https://twitter.com/avrylemalik93/status/1237241206523826176
Marami na tayong paalala sa mga tao upang makaiwas sa COVID-19. Tandaan lang natin na iwasan na ninyong hawakan yung taong bibitawan ka lang din.,tayong paalala tao upang makaiwas covid tandaan natin iwasan ninyong hawakan taong bibitawan,2020-03-17,14:00:03+00:00,https://twitter.com/MarkArtugz/status/1239914398342234116
"Di pinapasok para makaiwas sa covid 19, tas nakasalubong kami ni mam na nag gagala dito sa gupiing ",pinapasok makaiwas covid nakasalubong mam nag gagala gupiing,2020-03-10,09:45:54+00:00,https://twitter.com/_gibchun/status/1237313723426959360
"Hindi pa nag papapasok so LRT, 6AM pa daw ang operation. Bakit ganun! Lalong maiipon mga tao nyan. Ok na nga ung dating schedule eh!!! Yan ba ang solusyon nyo para makaiwas sa COVID-19! EH LALONG DUMAMI ANG TAO! ",nag papapasok lrt 6am daw operation ganun lalong maiipon tao nyan ok nga dating schedule yan solusyon nyo makaiwas covid lalong dumami tao,2020-03-12,21:52:41+00:00,https://twitter.com/ellababe003/status/1238221401019932672
"""Tip para makaiwas covid-19. Umiwas muna sa mga pampublikong transportation"" Hearing this while on the bus this morning... ",tip makaiwas covid umiwas muna pampublikong transportation hearing bus morning,2020-03-10,22:29:34+00:00,https://twitter.com/Croissant_jp/status/1237505904506884096
"Kung kailangan pinaka-kailangan ang tubig para makaiwas sa COVID, tsaka naman walang tubig. Keep uo naman tayo @maynilad.",pinaka tubig makaiwas covid tsaka tubig keep uo,2020-03-13,10:00:36+00:00,https://twitter.com/VoodooMatrix/status/1238404584436928512
Para makaiwas sa covid-19 iwasan nyong hawakan yung taong bibitawan ka lang din.,makaiwas covid iwasan nyong hawakan taong bibitawan,2020-03-17,17:01:10+00:00,https://twitter.com/superjiro_/status/1239959978867187713
Araw araw na nga ako mag-jajak*l para makaiwas CoVid.,araw araw nga jajak makaiwas covid,2020-03-12,15:30:13+00:00,https://twitter.com/EngineerDoctora/status/1238125149636812805
Na touch naman ako tawag na sila ng tawag kina kamusta ako OK lang OK lang yan nak may ncov pa dun baka dun ka na denied.,touch tawag tawag kina kamusta ok ok yan nak ncov dun baka dun denied,2020-02-18,14:36:05+00:00,https://twitter.com/MBLRCanlas/status/1229776606584901632
"Kahit ano gawin mo di ka naman kakapitan ng ncov, sino ba nag stay sayo? Lahat naman iniiwan ka diba?",gawin mo kakapitan ncov nag stay sayo iniiwan diba,2020-03-10,14:45:15+00:00,https://twitter.com/RudolfDaRedNose/status/1237389056729681925
"at sa dami ng nakasalamuha naming tao, posibleng isa sa kanila infected na ni mareng covid sana lang talag hindi.",dami nakasalamuha naming tao posibleng infected mareng covid talag,2020-03-11,09:50:47+00:00,https://twitter.com/noticemebunso/status/1237677338692702208
Daming ginagawa biro yung COVID-19,daming biro covid,2020-03-10,01:47:11+00:00,https://twitter.com/GalidoSteffan/status/1237193249036460032
Parang last wk lang we were enjoying the breeze of Baguio. Ngayon laganap na ang COVID-19 that was fast!,parang last wk enjoying breeze baguio laganap covid fast,2020-03-13,18:14:13+00:00,https://twitter.com/abilacorte/status/1238528810569453568
Self quarantine ng mag-isa ay di biro Covid-19 umalis ka sa Pinas please Miss ko na Ba be ko ,self quarantine biro covid umalis pinas please miss,2020-03-18,13:56:22+00:00,https://twitter.com/rongcalpj/status/1240275859153408000
"Tagging the local and national government, kung pwede po ay magtotal lockdown muna or magsuspend ng mga pasok para kahit papaano hindi lalaganap ang Covid-19, hihintayin pa ba natin hindi makayanan tugunan ng mga experto bago tayo kikilos? ",tagging local national government pwede magtotal lockdown muna magsuspend pasok papaano lalaganap covid hihintayin natin makayanan tugunan experto kikilos,2020-03-09,03:38:40+00:00,https://twitter.com/CatolicoKurt/status/1236858917386358786
BAKIT ANG DAMING PILIPINONG GINAGAWA LANG BIRO ANG COVID!??!??!??? COVID IS NOT A JOKE,daming pilipinong biro covid covid joke,2020-03-12,09:24:15+00:00,https://twitter.com/alexismacaraeg/status/1238033052460187649
Lord sa panahon ngayon na laganap yung Covid bigyan mo po ako ng lakas para makapag save pa ng mga tao #GodsPlan #InsurePeople #GodGivenMission #HelpMeSaveMoreLives,lord laganap covid bigyan mo lakas makapag save tao,2020-03-09,09:44:29+00:00,https://twitter.com/ConstanteCliff/status/1236950979074916352
"Makati Mayor Abby Binay: Hindi po ako nanakot, ako po ay nakikusap. Hindi po biro ang COVID-19",makati mayor abby binay nanakot nakikusap biro covid,2020-03-15,10:38:42+00:00,https://twitter.com/kim_badbadon/status/1239138949752164352
Hahaha happy sana kaso may laganap na Covid-19 sa labas. ,happy kaso laganap covid labas,2020-03-13,07:43:20+00:00,https://twitter.com/jekventures/status/1238370040853848070
"Thank you Mayor Joy Belmonte at least we know kung ano ang meron at wala. See you sa 2022 election. For now, let’s focus sa Covid-19.",thank mayor joy belmonte least know meron see election lets focus covid,2020-03-20,07:01:24+00:00,https://twitter.com/Xander_0720/status/1240896205653028864
"Hi Mayor Joy @officialqcmayor , please clarify regarding employees like me who work in Makati but QC residents, for example. Hindi n po kmi pwede lumabas ng QC to work? #Covid_19",hi mayor joy please clarify regarding employees like work makati qc residents example kmi pwede lumabas qc work,2020-03-13,04:28:50+00:00,https://twitter.com/scorpio1070/status/1238321096039862272
Mayor Joy parang mas gugustuhin q nalang mahawaan ng Covid 19 para gumalaw galaw kana dyan,mayor joy parang gugustuhin mahawaan covid gumalaw galaw kana dyan,2020-03-09,10:56:13+00:00,https://twitter.com/Euvsqtielicious/status/1236969030684045312
"Quezon City, naitala na ang unang kaso ng COVID-19 kinumpirma mismo ni Mayor Joy Belmonte ngayong umaga sa DZMM. #COVID19",quezon city naitala unang kaso covid kinumpirma mayor joy belmonte ngayong umaga dzmm,2020-03-09,01:06:11+00:00,https://twitter.com/DonBuenvenida/status/1236820544252592128
"Mayor Joy be like. "" I already announced that there’s positive case of covid 19 in QC.. that’s it..Im done"" ",mayor joy like already announced theres positive case covid qc thats done,2020-03-09,13:19:16+00:00,https://twitter.com/GaileeBunnyBeam/status/1237005031653556225
Quezon City Mayor Joy Belmonte meets with all top barangay officials of the city to discuss actions to be taken vs #NCov. ,quezon city mayor joy belmonte meets top barangay officials city discuss actions taken vs,2020-02-04,06:07:25+00:00,https://twitter.com/Jasmin_Romero/status/1224575164421042176
Jusko positive na COVID-19 dito sa QC. Ano na Mayor Joy? ,jusko positive covid qc mayor joy,2020-03-09,01:40:09+00:00,https://twitter.com/gnnsrrno/status/1236829093498241024
Bakit hindi trending si Mayor Joy dami hanash.. Mukhang lahat ng galit sa gobyerno taga QC. #Covid_19 #QuaratineLife #QuaratineLife,trending mayor joy dami hanash mukhang galit gobyerno taga qc,2020-03-21,23:27:13+00:00,https://twitter.com/murdoc_parker/status/1241506682384961536
