tweet,clean,date,time,link
In light of nCov and as precautionary measure there’s a temp check pt for everyone entering Light. The 3rd flr mall elev connecting to Light has a no entry/exit sign too. Mejo hassle but go push for everyone’s safety.,light ncov precautionary measure theres temp check pt everyone entering light 3rd flr mall elev connecting light entry exit sign mejo hassle go push everyones safety,2020-02-02,12:26:27+00:00,https://twitter.com/zayzaislets/status/1223945776021196806
Eat Bulaga has no live audience due to covid-19. I think dapat din ‘tong gawin ng ibang show that requires audience. It’s for everyone’s safety.,eat bulaga live audience due covid think gawin ibang show requires audience everyones safety,2020-03-09,06:23:19+00:00,https://twitter.com/mahnaipo/status/1236900354861568000
"As COVID-19 hits, pollution stops and our Mother Earth heals. Praying for everyone’s safety. More photos on IG: @noelontheroad",covid hits pollution stops mother earth heals praying everyones safety photos ig,2020-03-20,01:14:31+00:00,https://twitter.com/noelontheroad/status/1240808906575597569
"Hindi naman makakabawas ng case nang Covid yung pag babash nyo sa government eh, be mindful sa mga sinasabi nyo kung nakakatulong or hindi. ",makakabawas case covid babash nyo government mindful sinasabi nyo nakakatulong,2020-03-15,03:39:13+00:00,https://twitter.com/junjunathancp/status/1239033382316589056
"Santolan Pasig -WALA. Paging @VicoSotto paki kalampag nga po. Noong eleksyon ang sisipag magbahay-bahay. Nung pasko, may pa-party pa. Ngayon na may #Covid_19 wait lang daw. Isang lingo na kaming naghintay sa wala.",santolan pasig paging paki kalampag nga noong eleksyon sisipag magbahay bahay pasko party wait daw lingo kaming naghintay,2020-03-21,22:00:27+00:00,https://twitter.com/Deactivate2585/status/1241484844212858882
Check COVID BULLETIN updates on @IloveTaguig1 ,check covid bulletin updates,2020-03-14,06:02:42+00:00,https://twitter.com/dingdongbahan/status/1238707105571303424
He’s not even showing up mas malala pa yung sakit niya sa utak kaysa sa COVID-19 so he need not to worry about other people touching him coz no one would. (oopsz yung mga tuta niya pala kaya siyang hawakan dahil pare-parehas naman sila) ,hes even showing malala sakit utak covid need worry people touching coz would oopsz tuta pala siyang hawakan pare parehas,2020-03-09,12:34:27+00:00,https://twitter.com/leiixbianca/status/1236993754453565440
"nag-away kami ni mama dahil sa NCOV na yan, though gusto nya akong malayo sa sakit na yon, kaso usto ko lumabas ng bansa sa Holy week, pero buti maganda yung kapalit ng pagpunta ko ng Taiwan",nag away mama ncov yan though nya akong malayo sakit kaso lumabas bansa holy week buti maganda kapalit pagpunta taiwan,2020-02-24,04:27:38+00:00,https://twitter.com/iammarkrius/status/1231797812880232448
"Kahit na mag-hoard ka ng mga alcohol na kayang punuin ang isang Olympic-size Swimming Pool, kung ’yong kapit-bahay mo naman na wala nang mabili ay nahawaan ng CoVID-19, ikaw pa rin ang talo. Kaya please, stop hoarding and panic buying. Maawa kayo sa ibang tao mga peste kayo.",hoard alcohol kayang punuin olympic size swimming pool kapit bahay mo mabili nahawaan covid rin talo please stop hoarding panic buying maawa ibang tao,2020-03-12,11:11:37+00:00,https://twitter.com/supremodale/status/1238060071638065154
Mag JAKOL para makaiwas sa COVID 19 J- Just stay at home A- Always sanitize your hands K- Keep your hands clean O- On time maligo L- Lumayo sa matataong lugar Ligtas ang laging nag ja-JAKOL,jakol makaiwas covid stay home always sanitize hands keep hands clean time maligo lumayo matataong lugar ligtas laging nag jakol,2020-03-12,13:46:12+00:00,https://twitter.com/kyriemigs1/status/1238098974516449285
Mag JAKOL para makaiwas sa COVID 19 J- Just stay at home A- Always sanitize your hands K- Keep your hands clean O- On time maligo L- Lumayo sa matataong lugar Ligtas ang laging nag ja-JAKOL. ,jakol makaiwas covid stay home always sanitize hands keep hands clean time maligo lumayo matataong lugar ligtas laging nag jakol,2020-03-13,06:16:55+00:00,https://twitter.com/frazierbautsta_/status/1238348296722079745
Mag JAKOL para makaiwas sa COVID 19 J- Just stay at home A- Always sanitize your hands K- Keep your hands clean O- On time maligo L- Lumayo sa matataong lugar Ligtas ang laging nag ja-JAKOL,jakol makaiwas covid stay home always sanitize hands keep hands clean time maligo lumayo matataong lugar ligtas laging nag jakol,2020-03-12,14:16:42+00:00,https://twitter.com/NekolBarbadillo/status/1238106647764987905
Mag JAKOL para makaiwas sa COVID 19 J- Just stay at home A- Always sanitize your hands K- Keep your hands clean O- On time maligo L- Lumayo sa matataong lugar Ligtas ang laging nag ja-JAKOL,jakol makaiwas covid stay home always sanitize hands keep hands clean time maligo lumayo matataong lugar ligtas laging nag jakol,2020-03-13,02:30:23+00:00,https://twitter.com/_andreejabal/status/1238291286982942720
Mag JAKOL para makaiwas sa COVID 19 J- Just stay at home A- Always sanitize your hands K- Keep your hands clean O- On time maligo L- Lumayo sa matataong lugar Ligtas ang laging nag ja-JAKOL pass this message,jakol makaiwas covid stay home always sanitize hands keep hands clean time maligo lumayo matataong lugar ligtas laging nag jakol pass message,2020-03-12,14:38:08+00:00,https://twitter.com/Mtthwjcslm04/status/1238112040863936514
Mag JAKOL para makaiwas sa COVID 19 J- Just stay at home A- Always sanitize your hands K- Keep your hands clean O- On time maligo L- Lumayo sa matataong lugar Ligtas ang laging nag ja-JAKOL pass this message sa lahat ng mahal nio sa buhay. God bless everyone Staf safe ah ,jakol makaiwas covid stay home always sanitize hands keep hands clean time maligo lumayo matataong lugar ligtas laging nag jakol pass message mahal nio buhay god bless everyone staf safe ah,2020-03-12,15:38:22+00:00,https://twitter.com/TheGreatBrylle/status/1238127199045079040
Mag JAKOL para makaiwas sa COVID 19 J- Just stay at home A- Always sanitize your hands K- Keep your hands clean O- On time maligo L- Lumayo sa matataong lugar Ligtas ang laging nag ja-JAKOL,jakol makaiwas covid stay home always sanitize hands keep hands clean time maligo lumayo matataong lugar ligtas laging nag jakol,2020-03-12,13:53:09+00:00,https://twitter.com/nichsledesma/status/1238100719665725441
Mag JAKOL para makaiwas sa COVID 19 J- Just stay at home A- Always sanitize your hands K- Keep your hands clean O- On time maligo L- Lumayo sa matataong lugar Ligtas ang laging nag ja-JAKOL pass this message,jakol makaiwas covid stay home always sanitize hands keep hands clean time maligo lumayo matataong lugar ligtas laging nag jakol pass message,2020-03-12,14:18:03+00:00,https://twitter.com/patiwakal2606/status/1238106988774436866
Mag JAKOL para makaiwas sa COVID 19 J- Just stay at home A- Always sanitize your hands K- Keep your hands clean O- On time maligo L- Lumayo sa matataong lugar Ligtas ang laging nag ja-JAKOL,jakol makaiwas covid stay home always sanitize hands keep hands clean time maligo lumayo matataong lugar ligtas laging nag jakol,2020-03-12,14:15:29+00:00,https://twitter.com/MirasolJeremiah/status/1238106340683165697
Mag JAKOL para makaiwas sa COVID 19 J- ust stay at home A- lways sanitize your hands K- eep your hands clean O- n time maligo L- umayo sa matataong lugar Ligtas ang laging nag ja-JAKOL,jakol makaiwas covid ust stay home lways sanitize hands eep hands clean time maligo umayo matataong lugar ligtas laging nag jakol,2020-03-12,15:34:03+00:00,https://twitter.com/Kylechrstian/status/1238126113324273665
"Remember: NO ONE WANTS TO GET SICK. Whether it’s nCov or HIV, no one wants to fall ill. No one wants to infect other people (except those with criminal minds). Everyone wants to get better. And the only way to get better is to get access to health services.",remember wants get sick whether ncov hiv wants fall wants infect people except criminal minds everyone wants get better way get better get access health services,2020-01-31,15:38:32+00:00,https://twitter.com/yogawithben/status/1223269340323012608
Hahahaha itong nanay ko kala mo lahat ng kasama ko may covid eh,itong nanay mo kasama covid,2020-03-15,04:30:55+00:00,https://twitter.com/pauondrada/status/1239046393794154496
"Covid lang yan, mahal mo pa sya ee ",covid yan mahal mo sya ee,2020-03-11,13:57:24+00:00,https://twitter.com/emsi_arvic/status/1237739401532211201
"One takeaway from this nCov pandemic is that we should strengthen and add more teeth to laws against opportunists who add to the widespread panic and hysteria (i.e. those who share and peddle fake news, those who sell basic commodities at ridiculously high prices, etc.)",takeaway ncov pandemic strengthen add teeth laws opportunists add widespread panic hysteria share peddle fake news sell basic commodities ridiculously high prices etc,2020-03-12,07:20:02+00:00,https://twitter.com/claudiopoy/status/1238001790982828032
"May Arab kanina na lumapit sakin, nakikipag shake hands kase daw I was too kind. But I refuse the shake hands and wave in a polite way. #Covid_19",arab kanina lumapit sakin nakikipag shake hands kase daw kind refuse shake hands wave polite way,2020-03-13,09:40:15+00:00,https://twitter.com/gnnsrrno/status/1238399466924720128
COVID carriers could be among us. Tuloy lang ang precaution. Disinfect hands always. Carry a small spray bottle of alcohol with you.,covid carriers could among us tuloy precaution disinfect hands always carry small spray bottle alcohol,2020-03-01,23:51:57+00:00,https://twitter.com/DominoG/status/1234265146173714432
"When u do, sama mo na ako sa shake hands. After CoVid para mas safe. Thank you in advance .",mo shake hands covid safe thank advance,2020-03-19,06:01:55+00:00,https://twitter.com/MineIsSe7en/status/1240518847167205376
Hi guyszx reminder lang na ugaliing maligo dahil proper hygiene ang isa sa pinaka mabisang panlaban sa nCoV ,hi guyszx reminder ugaliing maligo proper hygiene pinaka mabisang panlaban ncov,2020-03-14,08:21:54+00:00,https://twitter.com/phoebecruz425/status/1238742135144243200
Mabisang panlaban sa covid-19 yan!!,mabisang panlaban covid yan,2020-03-18,16:24:49+00:00,https://twitter.com/manansalarengie/status/1240313216359518208
uminom ka lang..mabisang panlaban yan sa covid ,uminom mabisang panlaban yan covid,2020-03-16,14:24:40+00:00,https://twitter.com/aj_paril/status/1239558205144846342
#happening 3.3.20 @morning convocation..speaker - doc malu..topic - all about covid 19..#etiqaphilippines #etiqaph #etiqaMOD #morningconvocation .. @Oppen Building Sen. Gil Puyat Ave. Makati https://www.instagram.com/p/B9NkY6MB9PF/?igshid=1drx6d7encxzy,convocation speaker doc malu topic covid building gil puyat ave makati,2020-03-02,00:59:27+00:00,https://twitter.com/ilovemodfamily/status/1234282134145323008
#happening 3.3.20 @morning convocation..speaker - doc malu..topic - all about covid 19..#etiqaphilippines #etiqaph #etiqaMOD #morningconvocation .. @Oppen Building Sen. Gil Puyat Ave. Makati https://www.instagram.com/p/B9NkOwkhOrk/?igshid=16831t0j4svvv,convocation speaker doc malu topic covid building gil puyat ave makati,2020-03-02,00:58:05+00:00,https://twitter.com/ilovemodfamily/status/1234281790065410049
Ayoko manuod ng mga video about sa covid na yan tapos may namatay na ganun dahil hindi siya umaalis sa isip ko so pray lang tayo ,ayoko manuod video covid yan tapos namatay ganun umaalis isip pray,2020-03-16,16:28:40+00:00,https://twitter.com/Lionelserrano26/status/1239589408988205057
#happening 3.3.20 @morning convocation..speaker - doc malu..topic - all about covid 19..#etiqaphilippines #etiqaph #etiqaMOD #morningconvocation .. @Oppen Building Sen. Gil Puyat Ave. Makati https://www.instagram.com/p/B9Nku9zBQfo/?igshid=ds9w0z9uzj3d,convocation speaker doc malu topic covid building gil puyat ave makati,2020-03-02,01:03:34+00:00,https://twitter.com/ilovemodfamily/status/1234283171438399488
Sabi ko na eh. Ito talaga ang mabisang panlaban sa NCOV. ,mabisang panlaban ncov,2020-03-09,04:03:47+00:00,https://twitter.com/martin_bravo88/status/1236865237556400130
We do not promote FERN-D para makabenta. You can do your own research about Vitamin D kung paano ito naging mabisang panlaban sa COVID-19. Wag magsawalang bahala! Mas okay ng protected ang katawan mo ng vitamin D… https://www.instagram.com/p/B9otFhupT36/?igshid=12t4h428vj69s,promote fern makabenta research vitamin mabisang panlaban covid magsawalang bahala okay protected katawan mo vitamin,2020-03-12,13:54:57+00:00,https://twitter.com/_riajazmine_/status/1238101175607668736
#happening 3.3.20 @morning convocation..speaker - doc malu..topic - all about covid 19..#etiqaphilippines #etiqaph #etiqaMOD #morningconvocation .. @Oppen Building Sen. Gil Puyat Ave. Makati https://www.instagram.com/p/B9NkSo7BSVv/?igshid=1wb1o3hzip0d6,convocation speaker doc malu topic covid building gil puyat ave makati,2020-03-02,00:58:35+00:00,https://twitter.com/ilovemodfamily/status/1234281918314811400
"Hanggang prayers nalang talaga yung ""Sana hindi na magpapasok ng chinese lalo na’t meron nang case ng NCov"" + walang kwenta healthcare system lalo na kung wala kang sapat na pera. Maiiyak ka nalang sa takot eh. Kasi kahit gaano mo kagusto ingatan pamilya mo, di mo magagawa ",prayers magpapasok chinese lalo nat meron case ncov kwenta healthcare system lalo kang sapat pera maiiyak takot kasi gaano mo kagusto ingatan pamilya mo mo magagawa,2020-01-30,10:21:41+00:00,https://twitter.com/alinaesparrago/status/1222827212254007299
It’s likely unlikely that that man has the balls to face the consequences of not declaring the blocking of chinese entering the country with ncov that hadn’t hatch yet and will surely incubate and spread to our very own citizenry ,likely unlikely balls consequences declaring blocking chinese entering country ncov hadnt hatch yet surely incubate spread citizenry,2020-02-01,23:40:33+00:00,https://twitter.com/junepineda8/status/1223753029481951234
DAPAT BA AKONG MAGSUOT NG FACE MASK? Alamin kung sino-sino ang kailangang magsuot ng face mask sa infographic na ito! Ugaliin ang mga Preventive Measures upang makaiwas sa mga Respiratory Illness katulad ng 2019-nCoV! #ItoangTotoo #PreventiveMeasures #novelcoronavirus2019,akong magsuot mask alamin kailangang magsuot mask infographic ugaliin preventive measures upang makaiwas respiratory illness ncov,2020-02-03,11:52:42+00:00,https://twitter.com/HIVAIDSAGROUPPH/status/1224299670710566913
seriously kawawa kaming ground crew/cabin crew sa ncov. ibat ibang nationalities na galing sa mga bansang affected na ng ncov ang nakakasalamuha namin araw araw. free face mask for us and we should have a right para magsuot ng face mask sa work. haist skl lol,seriously kawawa kaming ground crew cabin crew ncov ibat ibang nationalities galing bansang affected ncov nakakasalamuha araw araw free mask us right magsuot mask work haist skl lol,2020-01-23,10:46:39+00:00,https://twitter.com/tinlovesjul/status/1220296784074854400
Kung ano ano kasi kinakain tas di naghuhugas ng kamay. #coronavirus,kasi kinakain naghuhugas kamay,2020-01-24,00:42:48+00:00,https://twitter.com/minachin9kit/status/1220507205155246080
Nakakaalarma yung kay sen migs zubiri.. Walang travel history at lagi nag aalcohol at naghuhugas ng kamay pero positive sa covid and asymptomatic..,nakakaalarma kay migs zubiri travel history nag aalcohol naghuhugas kamay positive covid asymptomatic,2020-03-16,13:16:25+00:00,https://twitter.com/hardhitterjames/status/1239541030623383554
"Haha, sobrang bilib ako sa mga tunay na lalakeng hindi naghuhugas ng kamay pagkatapos umihi bago magkaroon ng covid-19, AT PATULOY PA RIN NA HINDI NAGHUHUGAS NGAYON. Rak en rol!!! ",sobrang bilib tunay lalakeng naghuhugas kamay umihi magkaroon covid patuloy rin naghuhugas rak rol,2020-03-07,13:32:49+00:00,https://twitter.com/tikbalang/status/1236283665417564161
"Imagine a world where we can’t hug or kiss, we’re preventing ourselves from holding hands, and we engage in intercourse wearing face masks amid our nakedness. Plus, next to our lube and condoms is a bottle of sanitizer or alcohol. This, ppl, is Love in The Time of CoViD 19.",imagine world cant hug kiss preventing holding hands engage intercourse wearing masks amid nakedness plus next lube condoms bottle sanitizer alcohol ppl love time covid,2020-03-07,07:51:55+00:00,https://twitter.com/shade_of_tee/status/1236197873617797121
"random convo sa bahay ft. ate and tita: tita: hala gel, bawal na daw magkiss, bawal na rin daw magholding hands ate: oo nga daw tita: buti pa si blanch, single ate: oo nga, safe me: single: covid-19: pede na ko lumayas, bye",random convo bahay ft ate tita tita hala gel bawal daw magkiss bawal rin daw magholding hands ate oo nga daw tita buti blanch single ate oo nga safe single covid pede lumayas bye,2020-03-13,11:02:54+00:00,https://twitter.com/shrewdymich/status/1238420266004312064
Trinay ko mag bun ng hair kasi sabi ng prof namin pag naka corpo dapat naka ayos na pati hair. Eh puta nag muka akong chinese. Baka akalain may nCov ako ,trinay bun hair kasi prof naka corpo naka ayos pati hair puta nag muka akong chinese baka akalain ncov,2020-01-30,14:13:38+00:00,https://twitter.com/Piiiyayaaa/status/1222885587746615298
Muka lang akong chill. Pero natatakot nako sa covid-19 haha.,muka akong chill natatakot nako covid,2020-03-09,06:53:42+00:00,https://twitter.com/pennylane0923/status/1236907999664300032
Mag JAKOL para makaiwas sa COVID 19 J- Just stay at home A- Always sanitize your hands K- Keep your hands clean O- On time maligo L- Lumayo sa matataong lugar Kaya JAKOL NA,jakol makaiwas covid stay home always sanitize hands keep hands clean time maligo lumayo matataong lugar jakol,2020-03-12,14:20:46+00:00,https://twitter.com/SarmientoChichi/status/1238107673276461056
may sipon lang ako pero wala ako ncov prends ,sipon ncov prends,2020-02-03,00:54:37+00:00,https://twitter.com/nixalcts/status/1224134060412301312
oh sht tangina sinisipon ako!!!!!!! IS THIS NCOV KINAKABAHAN NA AKO ,sht sinisipon ncov kinakabahan,2020-02-02,05:43:50+00:00,https://twitter.com/xxpeyuh/status/1223844455410589696
"ang init ko tapos may sipon, may ncov na ba ako?",init tapos sipon ncov,2020-03-16,06:12:43+00:00,https://twitter.com/_antondeleon/status/1239434400451813376
"When you compare Mayor @VicoSotto’s recent tweets to his older ones, you can sense he’s stressed and tired. But what’s admirable is he’s still very much in control. Unlike certain senators whose biggest problem during this covid-19 lock down is being made to wash the dishes.",compare mayor recent tweets older ones sense hes stressed tired whats admirable hes still much control unlike certain senators whose biggest problem covid lock made wash dishes,2020-03-17,07:17:39+00:00,https://twitter.com/PINOYthruNthru/status/1239813132169576448
DOH may be ‘underreporting’ on COVID-19 – Lacson https://newsinfo.inquirer.net/1238230/doh-may-be-underreporting-on-covid-19 Matagal na kayo niloloko ng DOH now nyo lang napansin na under reporting mga data ng DOH while the rest of the world are panicking for the daily rise of NCov19,doh underreporting covid lacson matagal niloloko doh nyo napansin reporting data doh rest world panicking daily rise ncov19,2020-03-07,20:31:06+00:00,https://twitter.com/DragonTaipan/status/1236388929823096832
tatay: tamang tama nag resign ka dahil sa ncov naku me: advance ako mag isip t: naknampota hahahaha mga tirada mo chet ,tatay tamang tama nag resign ncov naku advance isip naknampota tirada mo chet,2020-03-10,11:16:07+00:00,https://twitter.com/___lius/status/1237336425537761281
papawis mamaya. kahit may ncov. ,papawis mamaya ncov,2020-03-14,05:11:54+00:00,https://twitter.com/dengsacedon/status/1238694320112164865
same situation sa brother ko nag pa book sila for march 27-28 for wedding and fully paid na sila dahil sa ncov nag decide na lang sila ipa reseched but instead nang hihingi ulit ng another downpayment ang mga kupal tas di pa maibalik yung ibinayad nila ng buo -,situation brother nag book march wedding fully paid ncov nag decide ipa reseched instead hihingi ulit another downpayment kupal maibalik ibinayad buo,2020-03-18,08:08:43+00:00,https://twitter.com/kihyuniemx/status/1240188367616131077
Iwasan muna baka mamaya may ncov crush mo mahawa kapa,iwasan muna baka mamaya ncov crush mo mahawa kapa,2020-03-13,10:45:14+00:00,https://twitter.com/gerardxx16/status/1238415817357676545
I just don’t underetand why people are more afraid of the nCOV than measles which has a higher mortality rate ,dont underetand people afraid ncov measles higher mortality rate,2020-02-07,10:54:37+00:00,https://twitter.com/jr_agcaoili/status/1225734604146921473
Gov said nCoV didn’t like warm weather ,gov said ncov didnt like warm weather,2020-02-04,11:37:58+00:00,https://twitter.com/djjoeysantos/status/1224658351386087424
So ayon sa chika merong may NCOV sa kabilang building namin sa work! We share the same smoking area pa naman!,ayon chika merong ncov kabilang building work share smoking area,2020-03-10,22:55:20+00:00,https://twitter.com/shihaoui/status/1237512390624698369
"Pag ganito ang sitwasyon sa bansa, etong mga Internet services natin SANA MAAYOS man lang at hindi ganito kabagal. Kasi Internet na lang ang kakapitan ng mga tao para mag-stay sa bahay, at para makakuha ng updates & info about COVID-19. @talk2GLOBE @PLDT_Cares ",ganito sitwasyon bansa etong internet services natin maayos ganito kabagal kasi internet kakapitan tao stay bahay makakuha updates info covid,2020-03-15,14:49:50+00:00,https://twitter.com/rlink21/status/1239202151307460608
Info on Covid! #COVIDー19,info covid,2020-03-16,02:19:25+00:00,https://twitter.com/jenasis818/status/1239375689469456384
Sa dinami dami ng credible sources ng info about Covid-19 dun ka pa talaga naniwala sa kumakalat na chain message sa fb messenger?,dinami dami credible sources info covid dun naniwala kumakalat chain message fb messenger,2020-03-12,00:29:06+00:00,https://twitter.com/huykalbo/status/1237898377947275266
Sorry po but UNICEF never released the ones spreading in socmed as clarified by UNICEF PH. Always refer to WHO or CDC for info about Covid po.,sorry unicef never released ones spreading socmed clarified unicef ph always refer cdc info covid,2020-03-09,16:05:35+00:00,https://twitter.com/ChocolateDazed/status/1237046883953999872
"Via @DOHgovph Ang mga matatanda, buntis, at may medikal na kondisyon ay kailangan umiwas sa matataong lugar at malawakang pagtitipon upang makaiwas sa COVID-19. #TaongBahay #TaongBayani",via matatanda buntis medikal kondisyon umiwas matataong lugar malawakang pagtitipon upang makaiwas covid,2020-03-17,01:04:54+00:00,https://twitter.com/roymarkcorrales/status/1239719323712643072
African Swine Fever × COVID-19 × Bird Flu This is devastating.,african swine fever covid bird flu devastating,2020-03-16,06:35:11+00:00,https://twitter.com/trixierious/status/1239440055275421699
"Binay: I will still continue with my 14-day quarantine. Hindi pa po tapos ang laban natin kontra sa COVID-19, and we don’t want to have a false sense of security",binay still continue day quarantine tapos natin kontra covid dont false sense security,2020-03-17,03:51:31+00:00,https://twitter.com/kim_badbadon/status/1239761255499358208
Kontra COVID 19 daw hahahaha.. Ginmansi ,kontra covid daw ginmansi,2020-03-19,15:25:46+00:00,https://twitter.com/murdoc_parker/status/1240660745106284546
Nakakabahala yung covid hays ingat ..,nakakabahala covid hays,2020-03-12,09:06:03+00:00,https://twitter.com/acmanolong/status/1238028472133378048
"Sumobra na pahinga ko huhu, COVID-19 stop kana please namimiss ko na work ko huhu.",sumobra pahinga covid stop kana please namimiss work,2020-03-19,12:10:39+00:00,https://twitter.com/loveLizamae/status/1240611643345625088
"Fam, with regards to the STRICT SOCIAL DISTANCING measures now pero worried on what to do & HAVE BEEN EXPERIENCING SYMPTOMS similar to COVID - my DM is open for inquiries &amp; questions. This is the least that I can do to help. I’m not in the frontline but I’m attending to my Tito +",fam regards strict social distancing measures worried experiencing symptoms similar covid dm open inquiries questions least help frontline attending tito,2020-03-15,04:09:27+00:00,https://twitter.com/jetzki06/status/1239040990490398721
Miss ko bebe ko tanginaa naman ng covid 19 nayarnnn diko sya makakasama ng matagal ,miss bebe tanginaa covid nayarnnn diko sya makakasama matagal,2020-03-12,15:05:31+00:00,https://twitter.com/dennystheticc_/status/1238118933036593152
hindi ko makuha ang esensya na ang gustong solusyon ng marami kontra CoViD-19 ay ang patalsikin si PRRD at wag sundin yung bilin. srsly guys? ,makuha esensya gustong solusyon kontra covid patalsikin prrd sundin bilin srsly guys,2020-03-13,08:05:28+00:00,https://twitter.com/KrysPublika/status/1238375611166371841
Hindi nako natutuwa sa covid nayan,nako natutuwa covid nayan,2020-03-17,10:39:54+00:00,https://twitter.com/adrnnecruz/status/1239864027506851840
"MISS, KASO DI KA NAMAN NA LUMALABAS KAHIT WALANG COVID-19 E HAHAHAHAAHAHAHAHA",miss kaso lumalabas covid hahahahaahahahaha,2020-03-19,09:56:53+00:00,https://twitter.com/shxlleanne/status/1240577979551338498
nabubulok na ko sa binangonan anunaa tangina covid 19 bwisit ka,nabubulok binangonan anunaa covid bwisit,2020-03-17,13:05:07+00:00,https://twitter.com/elayshakristi/status/1239900573031223298
"hoy @pearlblnctmo bait,talino tas chix tas sarap mo pa arat na inom na, covid lang yan sus HAHAHAHAHA jk, ss sa inyo duke covid lang yan teh char Keep slaying siz, more walwalan to come!! ",hoy bait talino chix sarap mo arat covid yan jk ss inyo duke covid yan char keep slaying walwalan,2020-03-21,18:48:09+00:00,https://twitter.com/nariojuliaaa/status/1241436452719702017
