tweet,date,time,link
"Dahil may bagong cases ng COVID-19 ngayon, it’s better to be safe and protected. Sa panahon ngayon di mo na alam kung sino ang may sakit. I’m selling Emergency Packs w/ Face Masks. There are 48 items inside. PM me for orders You can also check our FB: http://www.facebook.com/lifepack.ph",2020-03-07,02:50:25+00:00,https://twitter.com/jaspersalceda/status/1236121998289293312
Tangina kahapon pa ako nilalagnat tapos ang mababasa ko ngayon sa mga balita ay may confirmed case ng COVID-19 sa BGC. Lordt.,2020-03-07,02:47:38+00:00,https://twitter.com/notemmarie/status/1236121298910109696
Nakakatakot ngayong mas madaming ncov cases in the country mas lalong madelay and uaap?? #UAAPSeason82Volleyball,2020-03-07,02:07:23+00:00,https://twitter.com/hapipee/status/1236111170563530752
What if.... Kaya naman magconfirm ng DOH ng mga COVID cases ahead of time kaso naghihintay lang sila ng perfect moment like yung maingay na issueng pwedeng matabunan tulad ng mga Chinese/POGO bago nila iannounce?,2020-03-07,00:33:00+00:00,https://twitter.com/HashtagRonald/status/1236087419226619904
Pang laban coronavirus. Sino gusto ng face mask jan? ,2020-03-06,12:19:52+00:00,https://twitter.com/ulybog/status/1235902919121108992
Ayan na naman tayo sa COVID-19 scare. Praning na naman ako neto ,2020-03-06,08:24:47+00:00,https://twitter.com/kimsoncomph/status/1235843758375104518
Retweet if you think the number of COVID 19 patients from the Philippines is UNDETECTED. ,2020-03-06,02:10:47+00:00,https://twitter.com/thekatrinaa/status/1235749638159757313
Is the Philippines still COVID-19 -free? Better think twice... ,2020-03-06,00:59:56+00:00,https://twitter.com/MARKtheHUSH/status/1235731807422701568
There’s already been TWO reports of covid-19 cases from people who just recently came back to their home countries from the Philippines (Australia and Taiwan). Wtf is our government doing to address this issue. We’re literally gonna be walking dead in no time.,2020-03-05,14:29:00+00:00,https://twitter.com/thegrandpianist/status/1235573027808530433
z: can i ask u to buy me a box of face masks when u go to ? me: yea sure. innisfree? z: wdym innisfree? huh? me: the brand ba. thats the best brand for me. z: I MEANT CORONAVIRUS FACE MASKS THINGY BA. me: ... napa-face palm ako @zhanstuff,2020-03-04,16:36:19+00:00,https://twitter.com/crismercs11/status/1235242681132974080
Was at #LuckyChinatownMall awhile ago and noticed that almost 90% of Chinese citizens are wearing face mask as if we’ve got a confirmed #Coronavirus case in the country. Are they just being careful of acquiring it or they knew somerhing that we Filipinos didn’t know?! ,2020-03-04,16:17:19+00:00,https://twitter.com/crissyname/status/1235237898233864192
"Despite the efforts that the credible information about COVID-19 ARD, the Chinese Government is continuously censoring EVERYTHING, blocking the Chinese People from knowing what will be the consequence of the Outbreak. #COVID2019 #coronavirus",2020-03-02,01:25:11+00:00,https://twitter.com/Ortega082/status/1234288612985823232
"Not sure it means anything, but everyone in my barangay has cold symptoms similar to the COVID-19 disease. No testing equals no corona virus..oh, and we have a measles outbreak too. We love you @DOHgovph Lazy fuckers",2020-03-01,00:32:29+00:00,https://twitter.com/liampclancy/status/1233912961380450304
Dude saw coronavirus floating in the air and was trying to force quarantine it ! Seriously that is one crazy cop ,2020-02-29,23:26:05+00:00,https://twitter.com/Trader4lyf/status/1233896251680120832
Go na yan.. baon ka lang madaming mask and vitamins panlaban sa covid,2020-02-29,08:08:20+00:00,https://twitter.com/bmagcarang/status/1233665291764125696
"Honestly, I don’t think the Ncov number of Philippines is true and correct. Our country is soooo dense and we have the worst healthcare and our goverment doesnt really care that much. WHO is commending PH for containing the virus but yo,",2020-02-28,13:04:06+00:00,https://twitter.com/kimalexisgarcia/status/1233377333567901696
"Sa korya puro donations ang nababasa ko to aid Ncov, sa philippines warm water nalang tayo guyth, sana Summer na agad. Take care every every every one.",2020-02-28,12:48:08+00:00,https://twitter.com/Minosjunjun/status/1233373319342088194
"Yung mask ko suot ko di dahil sa ncov, kundi dahil sa katabi ko na hindi ata naliligo! – at VIP Lounge NAIA Terminal 4",2020-02-28,08:26:56+00:00,https://twitter.com/ImaMatilda/status/1233307584192335872
Me: Infer naman sa Pinas wala masyadong cases ng COVID-19 samantalang Japan tapos South Korea madami na Officemate: Syempre malakas resistensya ng mga Pinoy eh. Iba immune system natin pangmalakasan. Kumakain nga tayo ng buhangin nung bata pa tayo HAHAHAHAHAHAHA POTA LEGIT ,2020-02-28,01:51:34+00:00,https://twitter.com/notemmarie/status/1233208089039396865
I don’t believe that there are only 3 cases of #covid_19 in the Philippines. Just imagine the amount of illegal Chinese workers here. Then factor in the state of our mass transportation and healthcare system. Connect the dots and do the math.,2020-02-26,10:46:13+00:00,https://twitter.com/jepoyeng/status/1232617858841993216
Lemme make my own assumptions regarding CoVId reaching S.Korea. Not sure if everyone knows that this started as a Biochemical Weapon being made by the Chinese people &amp; was spread for reasons we are not sure how. Also its meant to be used to attack somewhere.. And how this spread,2020-02-26,06:46:13+00:00,https://twitter.com/wela0723/status/1232557461527121920
"People on social media reacting to how the Church deals with the #coronavirus (2/3) : Bishop: ""We rely on the discretion of the pastor on how to distribute ashes."" People: ""These priests don’t care about us! What if the ashes are infected with the virus?""",2020-02-24,23:13:48+00:00,https://twitter.com/jampransis1/status/1232081221447897088
Ayy. Ayaw ko nyan. Diba sabi sa paniki galing ang NCOV!,2020-02-24,14:27:11+00:00,https://twitter.com/mikygandara/status/1231948692401164288
Malamig kasi klima dun kaya madali madale immune system. Buti na lang magsummer na dito. Pero baka nasa 30k na rin nawala sakin dahil sa job cancellation due to ncov,2020-02-24,04:45:11+00:00,https://twitter.com/lis_poppy/status/1231802226978381824
"Yun nga e, taka ako alcohol na nga gamit nmin na lube pra iwas nCoV",2020-02-20,04:07:33+00:00,https://twitter.com/targarYum/status/1230343204571992064
Good amount of people wearing masks in Manila. Don’t they know heat kills coronavirus?,2020-02-16,05:15:48+00:00,https://twitter.com/phen214/status/1228910831514996738
sorry bawal kiss singhot lang pwede #ncov,2020-02-14,13:11:18+00:00,https://twitter.com/deynjerus/status/1228305717175521281
"THE BOSS On location. A month since after the novel coronavirus outbreak. Mallers are back, albeit slowly. For staff, face masks: don’t come to work without it. Malling at a time of coronavirus. Happy Friday folks.… https://www.instagram.com/p/B8ih6cUHgX_/?igshid=1qoku8615qcrf",2020-02-14,07:50:29+00:00,https://twitter.com/Cathy__Yang/status/1228224979776360450
NCOV No Chupa On Valentines,2020-02-12,17:49:45+00:00,https://twitter.com/AJMojica_/status/1227651015995842560
"DOH clarifies that COVID-19 is transmitted through droplets, contrary to reports that the disease is airborne",2020-02-12,02:08:29+00:00,https://twitter.com/kim_badbadon/status/1227414136591507457
Wala namang COVID-19 sa Tanglaw at Angono – at TV5 Media Center,2020-02-11,16:45:01+00:00,https://twitter.com/ReczonHimself/status/1227272338502119424
Ate heart pwede po ako pabili ng apples and kiat kiat sabi pangdagdag sa immune system ito at para malayo sa sakit at NcoV Ard ,2020-02-11,06:54:03+00:00,https://twitter.com/amsuperMCfordan/status/1227123616581439488
"NCOV is a virus, Virus is airborne therefore NCOV is airborne. Stay your hygiene clean everyone. ",2020-02-11,02:43:23+00:00,https://twitter.com/gnnsrrno/status/1227060531384578053
"Hi @agot_isidro as of now, the nCoV being airborne is just a THEORY by 1 Chinese official, and this claim has not been verified nor confirmed with enough suporting evidence. Kindly read this article on Newsweek for clarification: https://www.google.com.ph/amp/s/www.newsweek.com/coronavirus-could-airborne-chinese-official-claims-1486493%3famp=1",2020-02-11,01:21:26+00:00,https://twitter.com/miggyvmd/status/1227039907958231050
nCoV = No Chupa On Valentines ,2020-02-11,00:20:57+00:00,https://twitter.com/IAmJowABLEs/status/1227024686820626433
Airborne pala ang nCov ,2020-02-10,07:34:20+00:00,https://twitter.com/LA_inlarb/status/1226771367116201985
TANGINAAA AIRBONE NA ANG CORONAVIRUS!!! MEANING PWEDE KA NA MAHAWA THROUGH INHALATION!!!! ,2020-02-10,07:22:19+00:00,https://twitter.com/vivahotdeybs/status/1226768342473510913
masks are still unavailable and nCov is actually airborne... omfg... it seems that 2020 would be the end of my life hahuhuhuhu,2020-02-09,18:36:22+00:00,https://twitter.com/c08081_/status/1226575584181907456
Sakit sa Feb 14 ang NCOV.. N-No C-Cash O-On V-Valentines... ,2020-02-09,10:52:58+00:00,https://twitter.com/auticzon/status/1226458963706707969
"Gusto akong i-quarantine ni mami kasi may PUI kami ng Ncov kanina, chill lang ma, rumarampa nga ako sa ER kahit madaming may TB don. ",2020-02-07,12:37:27+00:00,https://twitter.com/shrmander/status/1225760483929509888
"It’s natural for China to stonewall medical information & the magnitude of the NCov epidemic - but based on China lockdown last January 23 and WHO’s delay in the declaration of PHEIC, we must be perceptive of the http://signs.It’s a chess game. Let’s protect ourselves.",2020-02-07,12:00:42+00:00,https://twitter.com/DrTonyLeachon/status/1225751236164481024
ncov proof ang ue college warriors. Nice.,2020-02-07,07:57:18+00:00,https://twitter.com/httpsangela_/status/1225689980514603008
"Have also heard from a Viber group that the coronavirus could be a lab sample gone rogue. The source appears to be very credible, but...we live in dangerous times. When technology exists to make words come out of a person’s mouth",2020-02-06,14:22:53+00:00,https://twitter.com/Starshadow/status/1225424630652948480
Ako lang ba yung NCOV? No Chocolates on Valentine’s,2020-02-06,12:48:07+00:00,https://twitter.com/wltrcnzn/status/1225400779621552128
"That’s strange. January 23: First virus outside Wuhan - lockdown or Travel restrictions placed on Wuhan’s neighboring cities, impacting millions of people. Why would WHO encourage travel to China , the source of NCOV when rest of the world imposes quarantine and travel bans ?",2020-02-05,15:34:17+00:00,https://twitter.com/DrTonyLeachon/status/1225080209939976192
"Super wala ako sa mood simula pa kanina tapos yung nakatayo sa tapat ko sa bus, umubo siszt, walang facemask, I just looked at him blankly and put alcohol on my hands, head and face. Hindi lang naman dahil sa ncov diba pero sana basic manners?",2020-02-05,01:43:45+00:00,https://twitter.com/eeyitsexoseri/status/1224871198409908224
Anti-viral properties of Virgin Coconut oil vs 2019-nCOV! Many Filipinos know this secret! @lalarimando @Philbizwatcher @CryptoInfoLYL #nCoV #Philippines #NovelCoronavirus,2020-02-05,01:32:18+00:00,https://twitter.com/Trader4lyf/status/1224868315731939328
But the nCov is not a biological attack? ,2020-02-04,15:58:15+00:00,https://twitter.com/NlCHOL/status/1224723851604459525
maxado sensationalize ncov n yan tignan mo s balita mxado mainit ang issue pero ang.mga tao tuloy lang ang buhay,2020-02-04,14:38:54+00:00,https://twitter.com/joel1531/status/1224703884779589632
Take extra precaution and boost immune system! Eat well and get enough sleep! 105 patients now being probed for novel coronavirus in PH ,2020-02-04,13:10:37+00:00,https://twitter.com/lawyernextdoor/status/1224681667102556160
Sotto shows film on nCoV as bioweapon vs China; Locsin calls it craziest video https://newsinfo.inquirer.net/1224005/sotto-shows-film-on-ncov-as-bioweapon-vs-china-locsin-calls-it-craziest-video via @inquirerdotnet,2020-02-04,12:46:28+00:00,https://twitter.com/k4tc4rl0/status/1224675587437907968
"I cringed when I heard na mas dapat katakutan ang HIV kesa sa nCoV. Mga mamsh, hindi airborne ang HIV at kayang agapan hanggang maging undetectable yung strain ng virus sa katawan. Meron ding kinocompare ang nCoV sa TB. Susmaryosep, Sir. I don’t want a DDS for a supervisor.",2020-02-04,06:16:35+00:00,https://twitter.com/phoebecruz425/status/1224577470084472834
"Please don’t compare #coronavirus #nCoV2019 to HIV. You are likely compairing oranges and apples. They are two different things. You cannot conclude that oranges are apples, or even apples are oranges. gets?",2020-02-04,00:59:26+00:00,https://twitter.com/ReignGwapito/status/1224497656493305857
"it was the chinese government’s fault. instead of addressing the issue back in december, they labeled the medical professionals who spotted #coronavirus as dissenters and as propagaters of lies and fear. there would be no outbreak if it wasn’t for beijing. ",2020-02-03,15:22:59+00:00,https://twitter.com/jlaurence/status/1224352588184743936
NCov Is less lethal than SARS but more contagious and infectious. The first death outside of China is a 44 year old male who suddenly died without the public being alerted on day one or even at ICU. Being young he must have been immune competent. Are we missing something?,2020-02-03,04:53:29+00:00,https://twitter.com/DrTonyLeachon/status/1224194170950053888
Forget Duterte. Si Quiboloy ang kailangan natin para sabihan ang nCoV ng: ISTAHP!,2020-02-03,03:54:47+00:00,https://twitter.com/PINOYthruNthru/status/1224179400448430080
"Keep safe everyone! If you wish to wear a face mask on public spaces due to the 2019 novel corona virus (nCoV), wear your masks properly with the colored portion outside and the white portion inside as seen on the screengrabs from Voltes V’s episode 33. ",2020-02-03,03:37:04+00:00,https://twitter.com/V5Documentary/status/1224174941081202688
"Class S po ako. Kami kami nila Eugene at Taguro. Gusto ko rin po maniwala kay Sec. Panelo na kailangan lang palakasin ang immune system. Pero, pero... Bakit naman may namatay dito sa Pinas? #Batang90s #ncov @… https://www.instagram.com/p/B8Em4J0n6pu/?igshid=hk044s3cbt3g",2020-02-02,16:56:36+00:00,https://twitter.com/iamteacherrj/status/1224013762224459776
"First nCoV-related death outside of China, sa Pilipinas po nangyari. The patient is a 44-yr-old man — OTHER THAN the first female Chinese patient who was declared positive of nCoV. Namatay daw sa ospital nung Saturday. Pero Sunday lang dineclare na dalawa sila, AFTER MAMATAY???",2020-02-02,13:29:27+00:00,https://twitter.com/yssavaldes/status/1223961628825116673
#CORONAVIRUS IS NOT AIRBORNE ,2020-02-02,10:24:33+00:00,https://twitter.com/jollymejulie/status/1223915099867377665
"Sobrang pakikisama naman pinakita ng Pilipinas sa China, 1st case of #ncoV related death. Gusto mag trend ng Pinas eh, kaya ayan Viral na rin. Vlogger ka Pinas?? ",2020-02-02,05:55:43+00:00,https://twitter.com/gryffindorommel/status/1223847443969662976
Pros and cons of using different masks! Know your mask and stay safe always 2019-nCov ARD ,2020-02-02,03:33:24+00:00,https://twitter.com/iamsuperarn/status/1223811631752212482
I think the DDS virus is scarier than nCoV.,2020-02-01,19:35:38+00:00,https://twitter.com/myckle/status/1223691395560435714
#CoronavirusPanic: ‘Cats and dogs thrown from tower blocks’ in China due to fake news romours that animlas are causing spread of the deadly virus. #nCoV ,2020-02-01,15:35:13+00:00,https://twitter.com/dannylomontes/status/1223630893908017152
Sobrang dame ko nakasalubong na chinese sa eastwood. Tas napahatching ako nung pauwi nako. May ncov naba ako nun ? ,2020-02-01,10:21:21+00:00,https://twitter.com/Yuanrivas10/status/1223551905558720512
"I was told a ketogenic diet improves the immune system, thus a good incentive in fighting ncoV.",2020-02-01,08:09:34+00:00,https://twitter.com/PeterPanFlies/status/1223518742627282944
It’s not about the dining culture and habits. There is no proof that this is the cause of the nCoV. I still believe the cause is the chinese govt biological warfare programs.,2020-02-01,03:53:27+00:00,https://twitter.com/rsgabitan/status/1223454285670666240
"Spectators in the #AustralianOpen Rod Laver arena undeterred by ncoV, without face masks. Absence of hysteria-peddling agents in Melbourne?",2020-02-01,03:47:51+00:00,https://twitter.com/PeterPanFlies/status/1223452876334223360
Informing people that nCoV is less fatal is not downplaying its seriousness. That’s called EDUCATING the people about the real state of affairs on this virus.,2020-02-01,03:25:12+00:00,https://twitter.com/Mother_Sith/status/1223447177898287104
"Sabi ng pinsan ko, hindi kaya Bad-karma na ng bad chinese people ang Ncov. I ask why did you say so And sabi nya, diba sakanila nag mumula yung mga fake na bagay like plastic rice, plastic noodles, plastic egg, plstc repolyo etc.",2020-02-01,03:07:15+00:00,https://twitter.com/marjohnlachica/status/1223442662973247488
"Eh baket kase pinagpipilitan nyo ang chinese travel ban eh hindi nga yan ang immediate solution. Juskorudy. Ncov has low fatality rate, less infectious than TB, and our first case came from HK, not China. Admit it, u just lurveee someone to blame. Kayo ang cause ng paniccc!!",2020-01-31,14:07:19+00:00,https://twitter.com/alexanderduca/status/1223246385408925697
How to protect yourself from NCov: 1. Wash/Discinfect your hands properly. 2. Wear face masks in crowded place. 3. Vote Wisely next election. #ncovph #coronavirusPH #CoronavirusOutbreak #ncovph #nCoV #nCoV2019 #coronavirus,2020-01-31,13:38:39+00:00,https://twitter.com/jmnfrncsco/status/1223239172057530368
Wear mask. Do not wear mask. Basta mag-hugas lagi ng kamay & stay hydrated! Refrain from spreading hate also lalo na sa country of origin of patient zero. #CoronavirusOutbreak #nCoV,2020-01-31,13:38:36+00:00,https://twitter.com/SantosDonnieG/status/1223239157222268928
"You kidding? How a poor guy who can’t even afford 3 meals a day is supposed to boost his/her immune system? Are you distributing Vitamins, Supplements or Food for public? Hell No! Right? Sir, not everyone is presidential spokesperson.#CoronaOutbreak #coronavirusPH #coronavirus ",2020-01-31,12:04:09+00:00,https://twitter.com/firangidacter/status/1223215389326200833
Sana gawin ni Duts versus nCoV yung same strategy versus Taal. Ihian niya yung virus. Tapos kainin niya yung laway at cough and sneeze droplets ng mga infected.,2020-01-31,11:44:59+00:00,https://twitter.com/gabemercado/status/1223210566077911040
instead sisihin nyo goverment natin na di agad nag ban ng flights. at di agad umaksyon nung inaanounce na may nCOV. and if naka face mask naman and laging nagaalcohol or naghuhugas ng kamay i think ok naman?? nasa hangin ba virus ewan di q pa sure HAHSHAHA,2020-01-31,11:26:18+00:00,https://twitter.com/h0ellyiannx/status/1223205863218761729
Ang laking tulong talaga ng Face Mask bukod sa proteksyon sa NCOV natatakpan na ang bibig ng mga TSISMOSA!,2020-01-31,11:17:56+00:00,https://twitter.com/KitSherwinCruz/status/1223203757694939137
"Pota.. Di ako pinasakay ng bus kanina. Sabi nung konduktor ""bawal chinese dito"". Gahd muka ba akong chinese?! Coronavirus pa more! Huhu. Mag-MRT nako!! Eto na.",2020-01-31,11:01:37+00:00,https://twitter.com/joeymdl/status/1223199649550307328
"So someone told me na mas okay daw gamitin ang face mask than N95 mask kasi pati ""daw"" sa eyes pwedeng pumasok yung corona virus. If you want to correct me on this please enlighten me, sinabi lang din kasi sya saken but still please wear mask ALL THE TIME #ncovph #coronavirus",2020-01-31,10:35:41+00:00,https://twitter.com/jmnfrncsco/status/1223193126891712513
Here at Cunanan Orthodental Clinic We ensure our patients “SAFETY” Because we care!! Due to the outbreak of the new strain of coronavirus “NCov” We only used hi-potent sanitizer:… https://www.instagram.com/p/B7-vhuiHGWJ3VISw_CXjXDsZbSf04TUEdrdviY0/?igshid=1hghc3gvegxek,2020-01-31,10:16:47+00:00,https://twitter.com/YourDent_Rick/status/1223188366797213697
Let’s hope & pray that Filipinos have this natural immunity (naturalesa) to nCoV &amp; our climate could kill this virus immediately. I suggest to stay under the sun even just for a few minutes for that dose of germ-killing UV rays and Vitamin D. #PrayForPhilippines #PrayForChina,2020-01-31,09:53:05+00:00,https://twitter.com/jazjez08/status/1223182404749123584
He says this new coronavirus is also not as deadly as the SARS and MERS strains. #MattersofFact #ANCHighlights,2020-01-31,09:42:31+00:00,https://twitter.com/russlclntfrancs/status/1223179747120730112
It will spread faster beacuse it’s a virus. You’re thinking too much. Chinese got sick because they don’t have proper hygiene. Pinoys? The most OAs in hygiene. The chances of you getting sick of nCoV is remote. Baka sa ibang way pa ma-hospital ang Pinoy.,2020-01-31,07:01:08+00:00,https://twitter.com/jalibieber/status/1223139131905101824
"pota di maalis sa isip ko yung baby, pota kung anak ko ’yon yayakapin ko siya ng sobrang higpit kahit alam kong infected siya ng coronavirus sobrang sakit na ultimo mga bata na walang alam sa nangyayari sa kapaligiran naapektuhan dahil sa virus na ’yan ",2020-01-31,05:31:58+00:00,https://twitter.com/ellaconchaa/status/1223116693049769989
Who says CORONAVirus is a joke? My new employer does! ,2020-01-31,05:22:34+00:00,https://twitter.com/yoursAries24/status/1223114326464090113
"Sorry, guys. Sobrang threatened lang ako. The NCoV is incurable, meaning, kapag nadapuan ka niyan, finish ka. Very alarming, lalo na ngayong may confirmed case na sa Pinas. ",2020-01-31,05:12:22+00:00,https://twitter.com/mjycmlng_/status/1223111757880647683
"Are you stupid or something? He just collapsed from for all we know any ailment. Since he’s Chinese and wearing a mask, you assume it’s coronavirus immediately? Then tweet that they’ll die? Stop spreading speculation and fake news. If you can’t help, just shut it! ",2020-01-31,05:09:36+00:00,https://twitter.com/ManuelPSev/status/1223111064822243329
DIY #coronavirus mask #2019nCoV,2020-01-31,04:57:08+00:00,https://twitter.com/dariophoto69/status/1223107927604510728
"TO AVOID NCov, REMEMBER WUHAN(like the Alamo) W- wash your hands thoroughly U- use proper mask H-have temperature checked regularly A-avoid large crowds N- never touch your face with unclean hands; no beso beso no handshake",2020-01-31,04:24:00+00:00,https://twitter.com/mgb819/status/1223099587843383297
How to counter nCov-2019 1. Wash your hands thoroughly 2. Drown the government with Alcohol 70% Solution to cleanse their stupidity. 3. VOTE WISELY NEXT ELECTION #CoronavirusOutbreak #coronavirusPH #coronavirus,2020-01-31,04:16:59+00:00,https://twitter.com/Trojeanwar/status/1223097820468563974
"Mama: Nak may nCoV na dito sa Pinas. Magsuot ka ng mask lagi. Me: Mama ubos na mask sa drugstore. Mama: May mga luma akong bra, guputin mo tapos gawin mong mask. Me: #GaanoKaKapraning",2020-01-31,02:40:19+00:00,https://twitter.com/Sbmsv_GiftedBot/status/1223073496869134336
"Doctor’s advice about coronavirus: Folks, take extra care and drink plenty of water. copy, paste and repost. #CoronaVirus #CoronaVirusOutbreak #CoronaVirusPH ",2020-01-31,01:34:01+00:00,https://twitter.com/iam_JVP6382/status/1223056809918775297
"Doctor’s advice about coronavirus: About prevention: 2. Aside from washing your hands frequently, you can gargle with strong mouthwash to eliminate or minimize the germs while they are still in your throat (before dripping down to your lungs).",2020-01-31,01:32:34+00:00,https://twitter.com/iam_JVP6382/status/1223056447019159552
Doctor’s advice about coronavirus: About the symptoms of the pneumonia caused by Coronavirus: is not like the normal kind. You will feel like you are drowning in water. It’s important to go seek immediate medical attention if you feel like this.,2020-01-31,01:29:35+00:00,https://twitter.com/iam_JVP6382/status/1223055692778442752
"Doctor’s advice about coronavirus: About the symptoms of the pneumonia caused by Coronavirus: into the trachea and enter the lungs, causing pneumonia. This process will take 5 to 6 days. 3. With pneumonia, comes high fever and difficulty in breathing. The nasal congestion",2020-01-31,01:27:39+00:00,https://twitter.com/iam_JVP6382/status/1223055206369284102
Tips on proper weaeing of face mask 1. Colored side of the mask faces outward and the white side of the mask is facing towards the face. 2. Gently press the thin metal wire agains the bridge of the nose. #STOPnCoV #Coronavirus #stopcoronavirus,2020-01-31,01:23:18+00:00,https://twitter.com/jhedboi86/status/1223054112754786306
Healthy and active lifestyle will save you not the mask... #coronavirus #healthylifestyle #healthyactivelifestyle,2020-01-31,01:14:16+00:00,https://twitter.com/Proud2Bpinoy/status/1223051841564479488
bwisit na nCov sa face mask lang napupunta lip balm ko di sa nguso ng crush ko,2020-01-31,00:59:04+00:00,https://twitter.com/chrs_uy/status/1223048015071436800
"#coronavirus #symptomsandprevention let’s all take care of ourselves and of others and prevent further spread of this deadly virus! #naturalhealthboosters #rovingocphotographer @Pasay City, Philippines https://www.instagram.com/p/B79sWYOhujM/?igshid=1atrx4hbdsd9o",2020-01-31,00:29:46+00:00,https://twitter.com/luz_orchid/status/1223040643032809472
Kilay lang sapat na! Seems like I will have to keep my lippies inside their storage container for awhile. No makeup look muna habang nagkakalat ng lagim si Ncov. Salamat sa ortho ni Bella sa face masks!… https://www.instagram.com/p/B79qsXlB9rD/?igshid=15hsrgrwbn058,2020-01-31,00:15:17+00:00,https://twitter.com/LiceraldeMar/status/1223036995363995648
